{
  "version": "2026.05",
  "dsVersion": "2026-05-19",
  "theme": "light",
  "screens": [
    {
      "id": "conflict-detail-screen",
      "component": "Stack",
      "layout": { "type": "stack", "gapToken": "section-default" },
      "props": {
        "data-surface": "c5-conflict-detail",
        "data-fixture": "conflict-detail-sample",
        "data-objectid": "obj-pricing-table"
      },
      "children": [
        {
          "id": "cd-header",
          "component": "Stack",
          "layout": { "type": "inline", "align": "space-between" },
          "style": { "spacingToken": "inset-default" },
          "props": { "data-region": "header" },
          "children": [
            {
              "id": "cd-header-title",
              "component": "Text",
              "props": {
                "text": "Pricing Table",
                "data-role": "entity-name",
                "data-entity-name": "Pricing Table"
              }
            },
            {
              "id": "cd-header-urn",
              "component": "Text",
              "props": {
                "text": "obj-pricing-table",
                "data-role": "entity-urn",
                "data-entity-urn": "obj-pricing-table"
              }
            }
          ]
        },
        {
          "id": "cd-candidate-summary",
          "component": "Card",
          "props": {
            "data-region": "candidate-summary",
            "data-confidence-tier": "high",
            "data-confidence-score": "0.88",
            "data-inferred-role": "data-display"
          },
          "children": [
            {
              "id": "cd-candidate-summary-header",
              "component": "Text",
              "props": { "text": "Stage1 Candidate", "data-role": "section-title" }
            },
            {
              "id": "cd-candidate-summary-row",
              "component": "Stack",
              "layout": { "type": "inline", "align": "start" },
              "children": [
                {
                  "id": "cd-candidate-tier",
                  "component": "Badge",
                  "props": {
                    "label": "high (0.88)",
                    "data-role": "confidence-badge",
                    "data-confidence-tier": "high",
                    "data-confidence-score": "0.88",
                    "data-flagged-for-review": "false"
                  }
                },
                {
                  "id": "cd-candidate-role",
                  "component": "Text",
                  "props": {
                    "text": "role: table → inferred data-display (0.93)",
                    "data-role": "candidate-role",
                    "data-inferred-role": "data-display",
                    "data-inferred-role-score": "0.93"
                  }
                },
                {
                  "id": "cd-candidate-domain",
                  "component": "Text",
                  "props": {
                    "text": "domain: billing",
                    "data-role": "candidate-domain",
                    "data-recommended-domain": "billing"
                  }
                }
              ]
            },
            {
              "id": "cd-candidate-reasoning",
              "component": "Text",
              "props": {
                "text": "Existing mapping uses Stateful+Listable; Stage1 recommends Stateful+Tabular+Selectable.",
                "data-role": "verdict-reasoning"
              }
            }
          ]
        },
        {
          "id": "cd-existing-mapping",
          "component": "Card",
          "props": {
            "data-region": "existing-mapping",
            "data-existing-map-id": "example-pricing-table"
          },
          "children": [
            {
              "id": "cd-existing-mapping-header",
              "component": "Text",
              "props": { "text": "Existing Mapping", "data-role": "section-title" }
            },
            {
              "id": "cd-existing-mapping-id",
              "component": "Text",
              "props": {
                "text": "id: example-pricing-table",
                "data-role": "existing-map-id-label",
                "data-existing-map-id": "example-pricing-table"
              }
            },
            {
              "id": "cd-existing-mapping-system",
              "component": "Text",
              "props": {
                "text": "externalSystem: example",
                "data-role": "existing-external-system",
                "data-external-system": "example"
              }
            },
            {
              "id": "cd-existing-mapping-traits",
              "component": "Stack",
              "layout": { "type": "inline", "align": "start" },
              "props": { "data-role": "existing-traits" },
              "children": [
                {
                  "id": "cd-existing-trait-stateful",
                  "component": "Badge",
                  "props": { "label": "Stateful", "data-role": "trait-pill", "data-trait-name": "Stateful" }
                },
                {
                  "id": "cd-existing-trait-listable",
                  "component": "Badge",
                  "props": { "label": "Listable", "data-role": "trait-pill", "data-trait-name": "Listable" }
                }
              ]
            }
          ]
        },
        {
          "id": "cd-alternate-interpretations",
          "component": "Card",
          "props": { "data-region": "alternate-interpretations" },
          "children": [
            {
              "id": "cd-alternates-header",
              "component": "Text",
              "props": { "text": "Alternate Interpretations", "data-role": "section-title" }
            },
            {
              "id": "cd-alt-0",
              "component": "Stack",
              "layout": { "type": "inline", "align": "start" },
              "props": {
                "data-role": "alternate-interpretation",
                "data-alternate-index": "0",
                "data-alternate-role": "data-grid",
                "data-alternate-score": "0.82"
              },
              "children": [
                { "id": "cd-alt-0-role", "component": "Badge", "props": { "label": "data-grid (0.82)", "data-role": "alternate-badge" } },
                { "id": "cd-alt-0-reasoning", "component": "Text", "props": { "text": "Cells exhibit grid-like keyboard navigation.", "data-role": "alternate-reasoning" } }
              ]
            },
            {
              "id": "cd-alt-1",
              "component": "Stack",
              "layout": { "type": "inline", "align": "start" },
              "props": {
                "data-role": "alternate-interpretation",
                "data-alternate-index": "1",
                "data-alternate-role": "list",
                "data-alternate-score": "0.74"
              },
              "children": [
                { "id": "cd-alt-1-role", "component": "Badge", "props": { "label": "list (0.74)", "data-role": "alternate-badge" } },
                { "id": "cd-alt-1-reasoning", "component": "Text", "props": { "text": "Row-major layout could be modeled as a list of plans.", "data-role": "alternate-reasoning" } }
              ]
            },
            {
              "id": "cd-alt-2",
              "component": "Stack",
              "layout": { "type": "inline", "align": "start" },
              "props": {
                "data-role": "alternate-interpretation",
                "data-alternate-index": "2",
                "data-alternate-role": "form",
                "data-alternate-score": "0.61"
              },
              "children": [
                { "id": "cd-alt-2-role", "component": "Badge", "props": { "label": "form (0.61)", "data-role": "alternate-badge" } },
                { "id": "cd-alt-2-reasoning", "component": "Text", "props": { "text": "Embedded plan-selection toggles add form-like semantics.", "data-role": "alternate-reasoning" } }
              ]
            }
          ]
        },
        {
          "id": "cd-remediation-hints",
          "component": "Card",
          "props": { "data-region": "remediation-hints" },
          "children": [
            {
              "id": "cd-hints-header",
              "component": "Text",
              "props": { "text": "Remediation Hints", "data-role": "section-title" }
            },
            {
              "id": "cd-hint-0",
              "component": "Stack",
              "layout": { "type": "stack", "gapToken": "cluster-tight" },
              "props": {
                "data-role": "remediation-hint",
                "data-hint-rank": "0",
                "data-hint-kind": "merge_with_existing",
                "data-hint-confidence": "0.9"
              },
              "children": [
                { "id": "cd-hint-0-kind", "component": "Badge", "props": { "label": "merge_with_existing", "data-role": "hint-kind-badge", "data-hint-kind": "merge_with_existing" } },
                { "id": "cd-hint-0-confidence", "component": "Badge", "props": { "label": "0.90", "data-role": "hint-confidence-badge", "data-hint-confidence": "0.9" } },
                { "id": "cd-hint-0-reasoning", "component": "Text", "props": { "text": "Patch existing mapping 'example-pricing-table' with the recommended trait set rather than creating a duplicate.", "data-role": "hint-reasoning" } }
              ]
            },
            {
              "id": "cd-hint-1",
              "component": "Stack",
              "layout": { "type": "stack", "gapToken": "cluster-tight" },
              "props": {
                "data-role": "remediation-hint",
                "data-hint-rank": "1",
                "data-hint-kind": "use_alternate_interpretation",
                "data-hint-confidence": "0.82"
              },
              "children": [